<?xml version="1.0" encoding="UTF-8"?>
<xs:schema xmlns:xs="http://www.w3.org/2001/XMLSchema" elementFormDefault="qualified">
  <xs:element name="icons">
    <xs:complexType>
      <xs:sequence>
        <xs:element maxOccurs="unbounded" ref="icon"/>
      </xs:sequence>
    </xs:complexType>
  </xs:element>
  <xs:element name="icon">
    <xs:complexType>
      <xs:sequence>
        <xs:element ref="name"/>
        <xs:element ref="title"/>
        <xs:choice maxOccurs="unbounded">
          <xs:element ref="description"/>
          <xs:element ref="extension"/>
        </xs:choice>
      </xs:sequence>
      <xs:attribute name="enabled-flag" use="required" type="xs:NCName"/>
      <xs:attribute name="height" use="required" type="xs:integer"/>
      <xs:attribute name="id" use="required" type="xs:NCName"/>
      <xs:attribute name="width" use="required" type="xs:integer"/>
    </xs:complexType>
  </xs:element>
  <xs:element name="name" type="xs:string"/>
  <xs:element name="title" type="xs:string"/>
  <xs:element name="description" type="xs:string"/>
  <xs:element name="extension">
    <xs:complexType>
      <xs:attribute name="direct-flag" use="required" type="xs:NCName"/>
      <xs:attribute name="id" use="required" type="xs:NCName"/>
      <xs:attribute name="secure-flag" use="required" type="xs:NCName"/>
    </xs:complexType>
  </xs:element>
</xs:schema>
